{
  "record_id": "rec-000000",
  "timestamp": "2026-08-17T12:00:00Z",
  "input_hash": "f78963353fb79e42",
  "protected_attrs": {
    "gender": "Male"
  },
  "prediction": {
    "label": 0,
    "probability": 0.3937
  },
  "sensitivity_signals": {
    "ps": 0.1768,
    "cfvr_interval": [
      0.1768,
      0.2268
    ],
    "df_epsilon": 0.0
  },
  "explanation": {
    "top_attributions": [],
    "ranked_actions": []
  },
  "routing": {
    "escalated": true,
    "trigger": "ps",
    "reasons": {
      "ps": true,
      "cfvr": true,
      "df_eps": true
    }
  },
  "review": {
    "reviewer_id": "",
    "decision": "",
    "reason": "",
    "review_timestamp": ""
  }
}